{
  "$schema": "https://json-schema.org/draft/2020-12/schema",
  "type": "object",
  "required": ["schema_version", "gate", "git_commit", "evidence_sha256", "approvals"],
  "properties": {
    "schema_version": {"const": 1},
    "gate": {"const": "G0"},
    "git_commit": {"type": "string", "pattern": "^[a-f0-9]{40}$", "not": {"const": "0000000000000000000000000000000000000000"}},
    "evidence_sha256": {"type": "string", "pattern": "^[a-f0-9]{64}$", "not": {"const": "0000000000000000000000000000000000000000000000000000000000000000"}},
    "approvals": {
      "type": "array",
      "minItems": 5,
      "maxItems": 5,
      "items": {
        "type": "object",
        "required": ["role", "approver", "decision", "approved_at"],
        "properties": {
          "role": {"enum": ["MT", "AO", "QO", "SO", "SCO"]},
          "approver": {"type": "string"},
          "decision": {"enum": ["pending", "approved", "rejected"]},
          "approved_at": {"type": ["string", "null"]},
          "notes": {"type": "string"}
        },
        "additionalProperties": false
      }
    }
  },
  "additionalProperties": false
}
