{
  "schema_version": 1,
  "gate": "G0",
  "git_commit": "0000000000000000000000000000000000000000",
  "evidence_sha256": "0000000000000000000000000000000000000000000000000000000000000000",
  "approvals": [
    {"role": "MT", "approver": "", "decision": "pending", "approved_at": null, "notes": ""},
    {"role": "AO", "approver": "", "decision": "pending", "approved_at": null, "notes": ""},
    {"role": "QO", "approver": "", "decision": "pending", "approved_at": null, "notes": ""},
    {"role": "SO", "approver": "", "decision": "pending", "approved_at": null, "notes": ""},
    {"role": "SCO", "approver": "", "decision": "pending", "approved_at": null, "notes": ""}
  ]
}
